{
  "schema_version": 1,
  "format": "workbench-registration-catalog-v1",
  "profile_family_id": "workbench-pack:supersymmetry",
  "authority_order": [
    {
      "id": "groovy",
      "rank": 1,
      "description": "Pack Groovy is the first construction authority whenever it performs the registration itself."
    },
    {
      "id": "susycore",
      "rank": 2,
      "description": "SuSyCore Java is used when Groovy only binds an existing object or has no constructor surface."
    },
    {
      "id": "pack-data",
      "rank": 3,
      "description": "Pack configuration, resources, and external-mod data are used only when neither Groovy nor SuSyCore owns the construction."
    }
  ],
  "observations": [
    {
      "authority": "groovy",
      "repository": "https://github.com/SymmetricDevs/Supersymmetry",
      "revision": "97a44866fe2079f30b4a89721a2625d2dd02f411",
      "branch": "master-ceu",
      "observed_date": "2026-08-01",
      "census": {
        "groovy_files": 301,
        "material_builder_text_occurrences": 2565,
        "parsed_numeric_material_registrations": 2479,
        "active_dynamic_material_builder_sites": 21,
        "recipe_builders": 4679,
        "build_and_register_calls": 4664,
        "recipe_map_aliases": 124,
        "meta_item_add_calls": 396,
        "ore_dictionary_add_calls": 129,
        "ore_dictionary_remove_calls": 6,
        "crafting_add_calls": 308,
        "crafting_replace_calls": 522,
        "crafting_remove_calls": 74,
        "event_listeners": 6
      }
    },
    {
      "authority": "susycore",
      "repository": "https://github.com/SymmetricDevs/Susy-Core",
      "revision": "587132a6b1b9b095142f802d3393a786a01868a5",
      "branch": "main",
      "observed_date": "2026-08-01",
      "census": {
        "java_files": 611,
        "material_builders": 41,
        "recipe_map_constructors": 100,
        "meta_tile_entity_registrations": 172,
        "forge_entity_registrations": 5,
        "tile_entity_registrations": 5,
        "cover_behavior_registrations": 4,
        "capability_registrations": 3,
        "biome_registrations": 2,
        "sound_registrations": 8,
        "particle_registrations": 34,
        "packet_registrations": 8,
        "gt_module_registrations": 9,
        "server_command_registrations": 4
      }
    }
  ],
  "families": [
    {
      "id": "materials",
      "label": "Materials and generated fluids",
      "description": "GT materials, including liquid and gas forms, are declared centrally and built in category register methods.",
      "lifecycle": "MaterialEvent at LOWEST after SuSyCore's HIGH listener",
      "selected_authority": "groovy",
      "authority_chain": [
        {
          "authority": "groovy",
          "role": "constructor",
          "paths": ["groovy/preInit/MaterialChanges.groovy", "groovy/material/SuSyMaterials.groovy", "groovy/material/*Materials*.groovy"],
          "note": "SuSyMaterials.init() calls category register() methods; each category assigns a new Material.Builder to the central field."
        },
        {
          "authority": "susycore",
          "role": "fallback",
          "paths": ["src/main/java/supersymmetry/common/materials/SusyMaterials.java", "src/main/java/supersymmetry/common/materials/SuSy*Materials.java"],
          "note": "SuSyCore registers its baseline materials first; pack-owned additions prefer Groovy."
        }
      ],
      "companion_surfaces": ["central static field", "category Material.Builder", "English localization", "generated GT material forms"],
      "active_instance_support": "ready",
      "pattern_keys": ["material-backed-fluid"]
    },
    {
      "id": "elements-isotopes",
      "label": "Elements and isotopes",
      "description": "Element identities and isotope-backed materials are constructed during the material lifecycle.",
      "lifecycle": "preInit MaterialEvent",
      "selected_authority": "groovy",
      "authority_chain": [
        {
          "authority": "groovy",
          "role": "constructor",
          "paths": ["groovy/preInit/RegisterIsotopes.groovy", "groovy/material/ElementMaterials.groovy", "groovy/material/IsotopeMaterials.groovy"],
          "note": "Groovy constructs Element objects and their Material.Builder registrations."
        },
        {
          "authority": "susycore",
          "role": "fallback",
          "paths": ["src/main/java/supersymmetry/common/materials/SuSyElementMaterials.java"],
          "note": "Core owns only the Java baseline not already supplied by the pack scripts."
        }
      ],
      "companion_surfaces": ["element identity", "material ID", "formula", "localization"],
      "active_instance_support": "planned",
      "pattern_keys": []
    },
    {
      "id": "material-flags-properties",
      "label": "Material flags and custom properties",
      "description": "Existing materials are modified and SuSy-specific fiber/fluid property types are attached.",
      "lifecycle": "MaterialEvent and PostMaterialEvent",
      "selected_authority": "groovy",
      "authority_chain": [
        {
          "authority": "groovy",
          "role": "constructor",
          "paths": ["groovy/classes/ChangeFlags.groovy", "groovy/preInit/MaterialChanges.groovy"],
          "note": "Groovy registers the base property type and applies pack flag/property changes."
        },
        {
          "authority": "susycore",
          "role": "fallback",
          "paths": ["src/main/java/supersymmetry/api/unification/material/properties", "src/main/java/supersymmetry/api/unification/material/info"],
          "note": "Core defines the custom Java property and icon types consumed by Groovy."
        }
      ],
      "companion_surfaces": ["property Java type", "Groovy base-type registration", "material flag mutation"],
      "active_instance_support": "planned",
      "pattern_keys": []
    },
    {
      "id": "meta-items",
      "label": "Simple meta-items",
      "description": "Pack-only simple items use a StandardMetaItem created from Groovy and numeric addItem registrations.",
      "lifecycle": "preInit PostMaterialEvent listener",
      "selected_authority": "groovy",
      "authority_chain": [
        {
          "authority": "groovy",
          "role": "constructor",
          "paths": ["groovy/preInit/RegisterMetaItems.groovy"],
          "note": "Simple pack components are registered with new StandardMetaItem(2) and addItem(id, name)."
        },
        {
          "authority": "susycore",
          "role": "fallback",
          "paths": ["src/main/java/supersymmetry/common/item/SuSyMetaItems.java"],
          "note": "Behavior-bearing items and Core-owned components remain Java registrations."
        }
      ],
      "companion_surfaces": ["numeric meta ID", "metaitem localization", "item model JSON", "item texture", "optional components/behavior"],
      "active_instance_support": "planned",
      "pattern_keys": []
    },
    {
      "id": "machine-recipes",
      "label": "GregTech machine recipes",
      "description": "Machine recipes are built in domain-organized postInit scripts against named recipe-map aliases.",
      "lifecycle": "postInit Groovy scripts",
      "selected_authority": "groovy",
      "authority_chain": [
        {
          "authority": "groovy",
          "role": "constructor",
          "paths": ["groovy/postInit/**/*.groovy", "groovy/prePostInit/Recipemaps.groovy"],
          "note": "Scripts call MAP.recipeBuilder(), add typed inputs/outputs, duration and EUt, then buildAndRegister()."
        },
        {
          "authority": "susycore",
          "role": "fallback",
          "paths": ["src/main/java/supersymmetry/loaders/recipes/SuSyRecipeLoader.java"],
          "note": "Java recipes are reserved for Core mechanics that cannot be expressed as ordinary pack recipes."
        }
      ],
      "companion_surfaces": ["existing recipe-map alias", "resolvable item/fluid identities", "domain postInit script"],
      "active_instance_support": "ready",
      "pattern_keys": ["machine-recipe"]
    },
    {
      "id": "crafting-smelting-recipes",
      "label": "Crafting and smelting recipes",
      "description": "Shaped, shapeless, replacement, and smelting recipes are authored through GroovyScript managers.",
      "lifecycle": "postInit Groovy scripts",
      "selected_authority": "groovy",
      "authority_chain": [
        {
          "authority": "groovy",
          "role": "constructor",
          "paths": ["groovy/postInit/**/*.groovy"],
          "note": "The pack uses crafting.add/replace methods and smelting managers alongside domain recipes."
        },
        {
          "authority": "susycore",
          "role": "fallback",
          "paths": ["src/main/java/supersymmetry/loaders/recipes/SuSyRecipeLoader.java"],
          "note": "Core supplies only mechanics-coupled recipe registrations."
        }
      ],
      "companion_surfaces": ["stable recipe name", "output identity", "ingredient grid", "recycling policy when applicable"],
      "active_instance_support": "planned",
      "pattern_keys": []
    },
    {
      "id": "recipe-removals-jei",
      "label": "Recipe removal, replacement, and JEI policy",
      "description": "Pack overhauls remove recipes by name/input and hide displaced categories or ingredients.",
      "lifecycle": "prePostInit and postInit Groovy scripts",
      "selected_authority": "groovy",
      "authority_chain": [
        {
          "authority": "groovy",
          "role": "constructor",
          "paths": ["groovy/prePostInit/ModifyRecipeMaps.groovy", "groovy/postInit/**/*.groovy"],
          "note": "Groovy owns removeAllRecipes, removeByInput, crafting.remove, replacement, and JEI yeet/hide calls."
        }
      ],
      "companion_surfaces": ["removal selector", "replacement recipe", "JEI visibility", "recycling consistency"],
      "active_instance_support": "planned",
      "pattern_keys": []
    },
    {